### ISSUE TITLE
LCS emulation not receiving packets from tap device

### ISSUE THREAD

**Issue by techfury90** [SDL-Hercules-390/hyperion#135]
Not sure if this is a host configuration issue or a Hyperion bug. I am attempting to connect VM to the host system in a host-only fashion. I am using an IP stack that does not support CTCI, so LCS must be used.

The two share a subnet of 192.168.10.0/24. I have assigned .2 for VM and .10 for the host. 

My configuration looks like such:
```
0B00.2  LCS  -m  02:00:FE:DF:00:42  192.168.10.2
```
I created a bridge and configured it like such:
```
brctl addbr herc0
brctl herc0 inet 192.168.10.10 up
(start Hyperion)
ifconfig tap0 up
brctl addif herc0 tap0
```
With this configuration, I am able to send packets out of Hyperion to the host, but no packets ever seem to make it to Hyperion from the host. If I use tcpdump -i tap0, the inbound packets from the host show up. 

I'm willing to believe it's a configuration issue, as Ivan appears to have LCS working. If it is, I'd be interested in knowing the proper details. 

Host is Ubuntu 18.04 LTS. IP forwarding is enabled.

**Comment by ivan-w** [comment]
1 : You have a guest OS that doesn't support CTCI but supports LCS... (what's that ?)
2 : How was the "tap0" interface defined ? Is it a persistent TUN/TAP interface ? 
3 : Why define a specific Mac address ?

My suggestion : 

1) Define a persistant tun/tap interface (using ip or openvpn)
2) Add the interface to your bridge (using brctl)
3) Bring the interface up (ifconfig up or ip link <xxx> set up)
3) Define a LCS that connects to the interface (-if <interface>)

**Comment by techfury90** [comment]
1. 5798-FAL 1.2. I don't think it supports CTCI because the TCPIP PROFILE has zero CTC examples. Just LCS, hyperchannel, a few third party Ethernet boxes, and X.25. 

2. I let Hyperion define it. 

3. No particular need, just did it for the sake of consistency in diagnosis. 

I will try your suggestions shortly and report back. Thanks!

**Comment by techfury90** [comment]
Same deal. If I put tcpdump on tap0, here is what I see when the host pings the VM:

`21:26:05.096846 ARP, Request who-has 192.168.10.2 tell hercbuntu, length 28`
`21:26:09.801057 ARP, Request who-has 192.168.10.2 tell hercbuntu, length 28`

Now, let's try pinging the host from VM:

`21:26:43.263751 ARP, Request who-has hercbuntu (27:18:00:79:27:c0 (oui Unknown)) tell 192.168.10.2, length 46`
`21:26:43.263777 ARP, Reply hercbuntu is-at ba:cf:38:fe:32:ed (oui Unknown), length 28`

I also enabled debugging, so my LCS statement is such:
`0B00.2 LCS -d -if tap0`

Again, we see a similar story: events like `HHC00983D 0:0B01 LCS: port 00: Send frame of size 60 bytes (with ARP packet) to device tap0`, but no incoming packet event ever occurs.

What I don't understand is why Hyperion seems oblivious to the packets, despite them showing up when I do tcpdump -I tap0...

**Comment by ivan-w** [comment]
FAL supports CTCI very well ! (It's the equivalent of 2 FAL stacks connected through a coupled CTC).

**Comment by ivan-w** [comment]
Look at : http://www.vm.ibm.com/pubs/pdf/hcsk5a10.pdf

Page 486

**Comment by techfury90** [comment]
That far back? I didn't see any examples for this extremely early release (this is 1.2 on VM/SP 6!), so I'm not sure if it'll be supported. I'll see what it does if I try.

**Comment by techfury90** [comment]
Not supported.

If I put the following in PROFILE TCPIP:
`DEVICE CTCDEV1 CTC B00`
`LINK CTCLINK1 CTC 0 CTCDEV1`
`HOME 192.168.200.1 CTCLINK1`

`Trying to open PROFILE TCPIP *`
`Using profile file PROFILE TCPIP *`
`Error encountered in reading PROFILE TCPIP:`
`Line 27: Invalid type field`
`Line 28: LINK statement: Invalid type field`

No CTC support, it seems.

**Comment by techfury90** [comment]
Back to LCS:

What I don't understand is that tcpdump sees the missed incoming packets on tap0, but yet Hercules never sees them. If it were a host configuration issue, I would expect there to be no inbound activity in tcpdump.

**Comment by ivan-w** [comment]
This is all very odd.. Here is my VM/SP 5 FAL stack definition using LCS : 

```
DEVICE ENT0 LCS E0      
LINK EN0 ETHERNET 0 ENT0
HOME                    
    192.168.100.207 EN0

```
Also ; 

```
q e00                          
3088 E00 ATTACH TO TCPIP    0E0
Ready; T=0.01/0.01 09:43:35    
q e01                          
3088 E01 ATTACH TO TCPIP    0E1
Ready; T=0.01/0.01 09:43:37    

```
hercules.cnf has : 

`E00.2   LCS     -if tap0`

My bridge/vswitch is as follows : 

```
# ovs-vsctl show
ec7714d0-149b-4445-a615-65af81fc13f4
    Bridge "br0"
<snip/>
        Port "tap0"
            Interface "tap0"
<snip/>

```
My network interfaces are as follows : 

```
root@db08:/home/ivan# ifconfig br0
br0: flags=4163<UP,BROADCAST,RUNNING,MULTICAST>  mtu 1280
        inet 192.168.100.1  netmask 255.255.255.0  broadcast 192.168.100.255
        inet6 fe80::506d:83ff:fefd:4643  prefixlen 64  scopeid 0x20<link>
        ether 00:50:56:c0:00:02  txqueuelen 1000  (Ethernet)
        RX packets 259876076  bytes 28109633112 (26.1 GiB)
        RX errors 0  dropped 31  overruns 0  frame 0
        TX packets 278407527  bytes 47030116669 (43.8 GiB)
        TX errors 2622  dropped 0 overruns 0  carrier 0  collisions 0

root@db08:/home/ivan# ifconfig tap0
tap0: flags=4163<UP,BROADCAST,RUNNING,MULTICAST>  mtu 1500
        inet6 fe80::a04b:a7ff:fe4c:5dd  prefixlen 64  scopeid 0x20<link>
        ether a2:4b:a7:4c:05:dd  txqueuelen 1000  (Ethernet)
        RX packets 1606172  bytes 538000478 (513.0 MiB)
        RX errors 0  dropped 0  overruns 0  frame 0
        TX packets 11816045  bytes 4052328631 (3.7 GiB)
        TX errors 0  dropped 88358 overruns 0  carrier 0  collisions 0

```
And the results for my VM FAL stack : 

```
netstat devlink                                                              
VM TCP/IP Netstat V2R1                                                       
                                                                             
Device ENT0              Type: LCS         Status: Ready                     
Queue size: 0            Address: 00E0                                       
   Link EN0              Type: ETHERNET    Net number: 0                     
Ready; T=0.02/0.05 09:45:36                                                  
netstat home                                                                 
VM TCP/IP Netstat V2R1                                                       
Home address list:                                                           
                                                                             
Address            Link                                                      
-------            ------                                                    
192.168.100.207    EN0                                                       
Ready; T=0.02/0.04 09:45:39                                                  
netstat gate                                                                 
VM TCP/IP Netstat V2R1                                                       
Known gateways:                                                              
                                                                             
NetAddress      FirstHop        Link     Pkt Sz  Subnet Mask     Subnet Value
----------      --------        ------   ------  -----------     ------------
Default         192.168.100.1   EN0      1500    <none>                      
192.168.100.0   <direct>        EN0      1500    <none>                      
Ready; T=0.02/0.05 09:45:41                                                  
ping 192.168.100.1                                                           
Ping V2R1: Pinging host 192.168.100.1.  Enter #CP EXT to interrupt.          
PING: Ping #1 response took 0.004 seconds. Successes so far 1.               
Ready; T=0.02/0.04 09:45:45                                                  
ping 192.168.100.2                                                           
Ping V2R1: Pinging host 192.168.100.2.  Enter #CP EXT to interrupt.          
PING: Ping #1 response took 0.003 seconds. Successes so far 1.               
Ready; T=0.02/0.04 09:45:49                                                  
ping 8.8.8.8                                                                 
Ping V2R1: Pinging host 8.8.8.8.  Enter #CP EXT to interrupt.                
PING: Ping #1 response took 0.003 seconds. Successes so far 1.               
Ready; T=0.02/0.04 09:45:53                                                  
```

Maybe try NOT specifying an IP address on your LCS definition in hercules.. It might be trying to act as a Layer 3 LCS ! Also I am not sure a default ubuntu install may not have a stringent firewall. (look at "iptables -L")

**Comment by techfury90** [comment]
Ah, I thought the IP was required for some reason. Why does the LCS emulation have so many layer3 options, anyway? Just idly curious. 

Let me try it without the IP and report back. 

Yeah, first thing I suspected was a firewall.. nope. iptables -L comes back completely empty.

**Comment by wably** [comment]
@techfury90, I am successfully using LCS with FAL 2.1 as well, in Debian.  But I am not using a bridge.  Rather, I am using a tunnel created by openvpn.  If you are interested in trying this approach, I can post the configuration and settings I am using.

**Comment by techfury90** [comment]
That would be much appreciated! I'm familiar with OpenVPN tunnels.

**Comment by wably** [comment]
@techfury90 Here are the configurations and related settings.

Network (all hardwired, no wireless):

     router/gateway:  192.168.1.1
     Debian host running Hyperion:  192.168.1.11
     VM Guest under Hyperion:  192.168.1.8

Hercules configuration file:

     0800-0801  LCS -n /dev/net/tun  -o lcsoat.txt

OAT file 'lcsoat.txt'.  Note that the last three bytes of the macaddr are the last three bytes of the guest's IP.

     *********************************************************
     * Dev  Mode Port Entry specific information             *
     *********************************************************
     0800  IP   00   PRI   192.168.1.8
     HWADD      00         02-00-5E-A8-01-08

Settings for the device in DMKRIO:

     RDEVICE ADDRESS=(800,32),DEVTYPE=3088
     RCTLUNIT ADDRESSS=800,CUTYPE=3088,FEATURE=32-DEVICE
     RCHANNEL ADDRESS=8,CHTYPE=BLKMPXR

Settings in /etc/rc.local in order to initialize the tunnel.  You could also issue these manually, to start with.  I have no special version of openvpn; I just have whatever apt-get installed.  Note: pointopoint below is spelled correctly.

     openvpn --mktun --dev tun0  --group herc
     ifconfig tun0 192.168.1.11 pointopoint 192.168.1.8
     echo "1" >/proc/sys/net/ipv4/conf/eth0/proxy_arp
     echo "1" >/proc/sys/net/ipv4/ip_forward

FAL 2.1 settings:

     DEVICE ENT0 LCS 800           
     LINK EN0 ETHERNET 0 ENT0     
       
     ; the local host's internet addresses                                   
     HOME                                                                    
        192.168.1.8    EN0                                                  
     
     ; Routing information (if you are not using the ROUTED server)          
     GATEWAY                                                                 
     ;  Network      First hop             Driver  Packet size  Subn mask  Subn value
        192.168.1.11   =                     EN0         1492        HOST                 
        DEFAULTNET  192.168.1.11             EN0         1492        0      
           
     START ENT0    

And of course the PROFILE EXEC for the TCPIP machine varies online device 800, and attaches it to itself as 800.    

This works great for me.  All of my other machines can ping the VM guest and the VM guest can ping them.  Good luck.

**Comment by wably** [comment]
@techfury90 were you able to get this to work?

Can we close this issue?

**Comment by Fish-Git** [comment]
No response from user. Closing issue.
